{
  "instrument_profile_id": "QDPINST-32B80CFFDD36218F",
  "platform_class": "SURFACED_PLATFORM",
  "device_ids": [],
  "supported_measurements": [
    "Cross-device discriminant sweep"
  ],
  "instrument_facing_requirement_satisfied": true,
  "notes": [
    "Generated from candidate surfaced experiment schedule."
  ]
}